{
  "schema_version": "1.0.0",
  "gate_event_id": "44444444-4444-4444-8444-444444444444",
  "gate_id": "network",
  "run_id": "demo-run",
  "attempt_id": "attempt-01",
  "plan_sha256": "0000000000000000000000000000000000000000000000000000000000000000",
  "action_digest": "0000000000000000000000000000000000000000000000000000000000000000",
  "scope": {
    "effect": "network",
    "description": "Fetch official dependency metadata"
  },
  "state": "not-applicable",
  "single_use": true,
  "expires_at": null,
  "approved_by": null,
  "origin": "local-observed",
  "consumed_by_command_id": null
}
